{
  "id": "torah-titans",
  "name": "Torah Titans",
  "tagline": "Heroes and villains of the ancient world",
  "description": "Biblical figures paired together - rivalries, spouses, trials, and more",
  "theme": "biblical",
  "cardModes": ["figure-figure", "solo-figure", "multi-figure"],
  "logoStyle": "ancient-gold",
  "defaultLogoPosition": "top-center",
  "cardRatio": "2.5x3.5",

  "cardTypes": {
    "rivalry": {
      "name": "Rivalry",
      "description": "Hero vs villain confrontation",
      "characterCount": 2,
      "templates": ["thunder-lightning", "thunder-lightning-dark", "beam-team", "beam-team-shadow", "metal-universe", "metal-universe-dark", "downtown", "kaboom", "prizm-silver"]
    },
    "spouse": {
      "name": "Spouse",
      "description": "Husband & wife partnership",
      "characterCount": 2,
      "templates": ["spouse-blessing", "beam-team", "prizm-silver"]
    },
    "trial": {
      "name": "Trial",
      "description": "Character facing a test/challenge",
      "characterCount": 1,
      "templates": ["trial-card", "thunder-lightning", "metal-universe"]
    },
    "multi": {
      "name": "Multi-Character",
      "description": "3+ characters (love triangles, etc.)",
      "characterCount": 3,
      "templates": ["three-way"]
    },
    "plague": {
      "name": "Plague",
      "description": "Moses vs Pharaoh + specific plague",
      "characterCount": 2,
      "templates": ["plague-card", "thunder-lightning-dark", "metal-universe-dark"]
    },
    "freedom-tour": {
      "name": "Freedom Tour",
      "description": "Stadium rock tour aesthetic - Moses vs Pharaoh as headliner vs venue",
      "characterCount": 2,
      "templates": ["freedom-tour"]
    },
    "plague-tour-stop": {
      "name": "Plague Tour Stop",
      "description": "Era-hopping plagues - each plague styled as different rock sub-genre",
      "characterCount": 2,
      "templates": ["plague-tour-stop"],
      "subOptions": {
        "eras": ["heavy-metal", "punk", "grunge", "hair-metal", "death-metal", "industrial", "power-metal", "thrash-metal", "goth", "arena-rock"],
        "plagues": ["blood", "frogs", "lice", "wild-beasts", "pestilence", "boils", "hail", "locusts", "darkness", "firstborn"]
      }
    },
    "backstage-pass": {
      "name": "Backstage Pass",
      "description": "Key confrontation moments as collectible concert credentials",
      "characterCount": 2,
      "templates": ["backstage-pass"],
      "subOptions": {
        "moments": ["who-is-the-lord", "let-my-people-go", "hardened-heart", "rise-and-go"]
      }
    },
    "tour-finale": {
      "name": "Tour Finale",
      "description": "Red Sea crossing as ultimate arena rock encore - FAREWELL EGYPT",
      "characterCount": 2,
      "templates": ["tour-finale"]
    }
  },

  "subSeries": {
    "spouses": {
      "name": "Biblical Spouses",
      "description": "Partnership cards featuring husbands and wives",
      "cardType": "spouse"
    },
    "abrahams-trials": {
      "name": "Abraham's 10 Trials",
      "description": "The tests that forged a patriarch",
      "cardType": "trial"
    },
    "plagues": {
      "name": "The 10 Plagues",
      "description": "Moses vs Pharaoh through each plague",
      "cardType": "plague"
    },
    "freedom-tour": {
      "name": "Egypt Freedom Tour",
      "description": "EXODUS: THE FREEDOM TOUR - Stadium rock meets ancient Egypt. 10 plagues as 10 tour stops with era-hopping rock aesthetics.",
      "cardTypes": ["freedom-tour", "plague-tour-stop", "backstage-pass", "tour-finale"],
      "tone": "playfully-irreverent"
    },
    "triangles": {
      "name": "Love Triangles",
      "description": "Multi-character relationship cards",
      "cardType": "multi"
    }
  },

  "availableTemplates": [
    "thunder-lightning",
    "thunder-lightning-dark",
    "beam-team",
    "beam-team-shadow",
    "metal-universe",
    "metal-universe-dark",
    "downtown",
    "kaboom",
    "prizm-silver",
    "spouse-blessing",
    "trial-card",
    "plague-card",
    "three-way",
    "freedom-tour",
    "plague-tour-stop",
    "backstage-pass",
    "tour-finale"
  ],

  "seriesSpecificTemplates": [
    "spouse-blessing",
    "trial-card",
    "plague-card",
    "three-way",
    "freedom-tour",
    "plague-tour-stop",
    "backstage-pass",
    "tour-finale"
  ],

  "priorityPairings": [
    "david-goliath",
    "moses-pharaoh",
    "jacob-esau",
    "abraham-sarah",
    "samson-delilah"
  ],

  "socialPlatforms": ["instagram"],
  "tone": {
    "style": "epic-reverent",
    "doNot": ["preachy", "flippant", "oversimplify"]
  }
}
